{
  "version": "aviation-history-1",
  "role": "history_quality_only",
  "source": "https://adsb.lol/globe_history/",
  "dependency_group": "adsb:adsblol",
  "license": "ODbL-1.0",
  "bbox": [14, 49, 29, 60],
  "windows": [
    {"date": "2026-09-22", "chunk": 33},
    {"date": "2026-09-23", "chunk": 33},
    {"date": "2026-09-24", "chunk": 33}
  ],
  "max_response_bytes": 32000000,
  "max_total_bytes": 96000000,
  "max_decoded_bytes": 160000000,
  "request_interval_seconds": 3,
  "collection_interval_seconds": 3600,
  "timeout_seconds": 25,
  "live_releases": [
    "av-2026-09-24T164515Z-6a3b31d1",
    "av-2026-09-24T164659Z-68b99c4b",
    "av-2026-09-24T164929Z-d612456c"
  ]
}
